{
  "$schema": "https://json-schema.org/draft/2020-12/schema",
  "$id": "urn:rtx-monitor:schema:nvapi-cooler-status-v1-observation:1",
  "title": "RTX Monitor NVAPI cooler status v1 observation v1",
  "type": "object",
  "additionalProperties": false,
  "required": [
    "schema_version",
    "source_kind",
    "profile_name",
    "capture_started_utc",
    "captured_utc",
    "duration_seconds",
    "process_id",
    "gpuz_sha256",
    "debugger_sha256",
    "debugger_file_version",
    "candidate_inventory_sha256",
    "prior_observation_sha256",
    "nvapi_module_sha256",
    "interface_id",
    "function_rva",
    "caller_module_name",
    "caller_rvas",
    "capture_point",
    "buffer_pointer_expression",
    "return_status_register",
    "structure_version",
    "structure_size_bytes",
    "structure_word_count",
    "count_byte_offset",
    "entry_base_offset",
    "entry_stride_bytes",
    "entry_capacity",
    "raw_field_byte_offsets_within_entry",
    "reference_log",
    "call_count",
    "call_sites",
    "samples",
    "warning"
  ],
  "properties": {
    "schema_version": {
      "const": 1
    },
    "source_kind": {
      "const": "nvapi_cooler_status_v1_observation"
    },
    "profile_name": {
      "const": "gpuz-2.70.0-nvapi-610.88-cooler-status-v1"
    },
    "capture_started_utc": {
      "type": "string",
      "format": "date-time"
    },
    "captured_utc": {
      "type": "string",
      "format": "date-time"
    },
    "duration_seconds": {
      "type": "integer",
      "minimum": 10,
      "maximum": 60
    },
    "process_id": {
      "type": "integer",
      "minimum": 1
    },
    "gpuz_sha256": {
      "const": "6cb0ef29682452de81a9576808881685161411a1fad00938ba04131159979c29"
    },
    "debugger_sha256": {
      "$ref": "#/$defs/sha256"
    },
    "debugger_file_version": {
      "type": "string",
      "minLength": 1
    },
    "candidate_inventory_sha256": {
      "$ref": "#/$defs/sha256"
    },
    "prior_observation_sha256": {
      "$ref": "#/$defs/sha256"
    },
    "nvapi_module_sha256": {
      "const": "fbc9aed43bfa5bda19b7f83a809a081a0ce454b6d6003dcabc565ecb3e6afdaf"
    },
    "interface_id": {
      "const": "0x35aed5e8"
    },
    "function_rva": {
      "const": "0x001b9f10"
    },
    "caller_module_name": {
      "const": "GPU-Z.exe"
    },
    "caller_rvas": {
      "type": "array",
      "prefixItems": [
        {
          "const": "0x0021d654"
        },
        {
          "const": "0x0021d824"
        }
      ],
      "items": false,
      "minItems": 2,
      "maxItems": 2
    },
    "capture_point": {
      "const": "post_call_return"
    },
    "buffer_pointer_expression": {
      "const": "poi(@esp+4)"
    },
    "return_status_register": {
      "const": "eax"
    },
    "structure_version": {
      "const": "0x000106a8"
    },
    "structure_size_bytes": {
      "const": 1704
    },
    "structure_word_count": {
      "const": 426
    },
    "count_byte_offset": {
      "const": 4
    },
    "entry_base_offset": {
      "const": 40
    },
    "entry_stride_bytes": {
      "const": 52
    },
    "entry_capacity": {
      "const": 32
    },
    "raw_field_byte_offsets_within_entry": {
      "type": "array",
      "prefixItems": [
        {
          "const": 4
        },
        {
          "const": 8
        },
        {
          "const": 12
        },
        {
          "const": 16
        }
      ],
      "items": false,
      "minItems": 4,
      "maxItems": 4
    },
    "reference_log": {
      "type": "object",
      "additionalProperties": false,
      "required": [
        "size_bytes_before",
        "size_bytes_midpoint",
        "size_bytes_after",
        "last_write_utc_before",
        "last_write_utc_midpoint",
        "last_write_utc_after",
        "last_sample_local_before",
        "last_sample_local_midpoint",
        "last_sample_local_after",
        "grew_during_capture"
      ],
      "properties": {
        "size_bytes_before": {
          "type": "integer",
          "minimum": 1
        },
        "size_bytes_midpoint": {
          "type": "integer",
          "minimum": 1
        },
        "size_bytes_after": {
          "type": "integer",
          "minimum": 1
        },
        "last_write_utc_before": {
          "type": "string",
          "format": "date-time"
        },
        "last_write_utc_midpoint": {
          "type": "string",
          "format": "date-time"
        },
        "last_write_utc_after": {
          "type": "string",
          "format": "date-time"
        },
        "last_sample_local_before": {
          "$ref": "#/$defs/local_timestamp"
        },
        "last_sample_local_midpoint": {
          "$ref": "#/$defs/local_timestamp"
        },
        "last_sample_local_after": {
          "$ref": "#/$defs/local_timestamp"
        },
        "grew_during_capture": {
          "const": true
        }
      }
    },
    "call_count": {
      "type": "integer",
      "minimum": 2
    },
    "call_sites": {
      "type": "array",
      "prefixItems": [
        {
          "$ref": "#/$defs/call_site_0021d654"
        },
        {
          "$ref": "#/$defs/call_site_0021d824"
        }
      ],
      "items": false,
      "minItems": 2,
      "maxItems": 2
    },
    "samples": {
      "type": "array",
      "minItems": 2,
      "items": {
        "type": "object",
        "additionalProperties": false,
        "required": [
          "sequence",
          "thread_id",
          "caller_rva",
          "return_status",
          "buffer_address",
          "structure_version",
          "observed_count",
          "raw_words",
          "raw_entries"
        ],
        "properties": {
          "sequence": {
            "type": "integer",
            "minimum": 1
          },
          "thread_id": {
            "$ref": "#/$defs/word"
          },
          "caller_rva": {
            "enum": [
              "0x0021d654",
              "0x0021d824"
            ]
          },
          "return_status": {
            "const": "0x00000000"
          },
          "buffer_address": {
            "$ref": "#/$defs/word"
          },
          "structure_version": {
            "const": "0x000106a8"
          },
          "observed_count": {
            "type": "integer",
            "minimum": 1,
            "maximum": 32
          },
          "raw_words": {
            "type": "array",
            "prefixItems": [
              {
                "const": "0x000106a8"
              }
            ],
            "items": {
              "$ref": "#/$defs/word"
            },
            "minItems": 426,
            "maxItems": 426
          },
          "raw_entries": {
            "type": "array",
            "minItems": 1,
            "maxItems": 32,
            "items": {
              "$ref": "#/$defs/raw_entry"
            }
          }
        }
      }
    },
    "warning": {
      "type": "string",
      "minLength": 1
    }
  },
  "$defs": {
    "sha256": {
      "type": "string",
      "pattern": "^[0-9a-f]{64}$"
    },
    "word": {
      "type": "string",
      "pattern": "^0x[0-9a-f]{8}$"
    },
    "local_timestamp": {
      "type": "string",
      "pattern": "^[0-9]{4}-[0-9]{2}-[0-9]{2} [0-9]{2}:[0-9]{2}:[0-9]{2}$"
    },
    "call_site_0021d654": {
      "type": "object",
      "additionalProperties": false,
      "required": [
        "caller_rva",
        "call_count"
      ],
      "properties": {
        "caller_rva": {
          "const": "0x0021d654"
        },
        "call_count": {
          "type": "integer",
          "minimum": 1
        }
      }
    },
    "call_site_0021d824": {
      "type": "object",
      "additionalProperties": false,
      "required": [
        "caller_rva",
        "call_count"
      ],
      "properties": {
        "caller_rva": {
          "const": "0x0021d824"
        },
        "call_count": {
          "type": "integer",
          "minimum": 1
        }
      }
    },
    "raw_entry": {
      "type": "object",
      "additionalProperties": false,
      "required": [
        "entry_index",
        "base_word_index",
        "raw_identifier_word",
        "raw_field_words"
      ],
      "properties": {
        "entry_index": {
          "type": "integer",
          "minimum": 0,
          "maximum": 31
        },
        "base_word_index": {
          "type": "integer",
          "minimum": 10,
          "maximum": 413
        },
        "raw_identifier_word": {
          "$ref": "#/$defs/word"
        },
        "raw_field_words": {
          "type": "array",
          "items": {
            "$ref": "#/$defs/word"
          },
          "minItems": 4,
          "maxItems": 4
        }
      }
    }
  }
}
