{
  "schema_version": 1,
  "source_kind": "nvapi_cooler_status_v1_observation",
  "profile_name": "gpuz-2.70.0-nvapi-610.88-cooler-status-v1",
  "capture_started_utc": "2026-08-27T20:00:00Z",
  "captured_utc": "2026-08-27T20:00:10Z",
  "duration_seconds": 10,
  "process_id": 1234,
  "gpuz_sha256": "6cb0ef29682452de81a9576808881685161411a1fad00938ba04131159979c29",
  "debugger_sha256": "1111111111111111111111111111111111111111111111111111111111111111",
  "debugger_file_version": "1.0.0.0",
  "candidate_inventory_sha256": "2222222222222222222222222222222222222222222222222222222222222222",
  "prior_observation_sha256": "3333333333333333333333333333333333333333333333333333333333333333",
  "nvapi_module_sha256": "fbc9aed43bfa5bda19b7f83a809a081a0ce454b6d6003dcabc565ecb3e6afdaf",
  "interface_id": "0x35aed5e8",
  "function_rva": "0x001b9f10",
  "caller_module_name": "GPU-Z.exe",
  "caller_rvas": [
    "0x0021d654",
    "0x0021d824"
  ],
  "capture_point": "post_call_return",
  "buffer_pointer_expression": "poi(@esp+4)",
  "return_status_register": "eax",
  "structure_version": "0x000106a8",
  "structure_size_bytes": 1704,
  "structure_word_count": 426,
  "count_byte_offset": 4,
  "entry_base_offset": 40,
  "entry_stride_bytes": 52,
  "entry_capacity": 32,
  "raw_field_byte_offsets_within_entry": [
    4,
    8,
    12,
    16
  ],
  "reference_log": {
    "size_bytes_before": 100,
    "size_bytes_midpoint": 200,
    "size_bytes_after": 300,
    "last_write_utc_before": "2026-08-27T20:00:00Z",
    "last_write_utc_midpoint": "2026-08-27T20:00:05Z",
    "last_write_utc_after": "2026-08-27T20:00:10Z",
    "last_sample_local_before": "2026-08-27 17:00:00",
    "last_sample_local_midpoint": "2026-08-27 17:00:05",
    "last_sample_local_after": "2026-08-27 17:00:10",
    "grew_during_capture": true
  },
  "call_count": 2,
  "call_sites": [
    {
      "caller_rva": "0x0021d654",
      "call_count": 1
    },
    {
      "caller_rva": "0x0021d824",
      "call_count": 1
    }
  ],
  "samples": [
    {
      "sequence": 1,
      "thread_id": "0x00000001",
      "caller_rva": "0x0021d654",
      "return_status": "0x00000000",
      "buffer_address": "0x0813efac",
      "structure_version": "0x000106a8",
      "observed_count": 2,
      "raw_words": [
        "0x000106a8",
        "0x00000002",
        "0x00000000",
        "0x00000000",
        "0x00000000",
        "0x00000000",
        "0x00000000",
        "0x00000000",
        "0x00000000",
        "0x00000000",
        "0x00000001",
        "0x10000001",
        "0x20000001",
        "0x30000001",
        "0x40000001",
        "0x00000000",
        "0x00000000",
        "0x00000000",
        "0x00000000",
        "0x00000000",
        "0x00000000",
        "0x00000000",
        "0x00000000",
        "0x00000002",
        "0x50000001",
        "0x60000001",
        "0x70000001",
        "0x01000001",
        "0x00000000",
        "0x00000000",
        "0x00000000",
        "0x00000000",
        "0x00000000",
        "0x00000000",
        "0x00000000",
        "0x00000000",
        "0x00000000",
        "0x00000000",
        "0x00000000",
        "0x00000000",
        "0x00000000",
        "0x00000000",
        "0x00000000",
        "0x00000000",
        "0x00000000",
        "0x00000000",
        "0x00000000",
        "0x00000000",
        "0x00000000",
        "0x00000000",
        "0x00000000",
        "0x00000000",
        "0x00000000",
        "0x00000000",
        "0x00000000",
        "0x00000000",
        "0x00000000",
        "0x00000000",
        "0x00000000",
        "0x00000000",
        "0x00000000",
        "0x00000000",
        "0x00000000",
        "0x00000000",
        "0x00000000",
        "0x00000000",
        "0x00000000",
        "0x00000000",
        "0x00000000",
        "0x00000000",
        "0x00000000",
        "0x00000000",
        "0x00000000",
        "0x00000000",
        "0x00000000",
        "0x00000000",
        "0x00000000",
        "0x00000000",
        "0x00000000",
        "0x00000000",
        "0x00000000",
        "0x00000000",
        "0x00000000",
        "0x00000000",
        "0x00000000",
        "0x00000000",
        "0x00000000",
        "0x00000000",
        "0x00000000",
        "0x00000000",
        "0x00000000",
        "0x00000000",
        "0x00000000",
        "0x00000000",
        "0x00000000",
        "0x00000000",
        "0x00000000",
        "0x00000000",
        "0x00000000",
        "0x00000000",
        "0x00000000",
        "0x00000000",
        "0x00000000",
        "0x00000000",
        "0x00000000",
        "0x00000000",
        "0x00000000",
        "0x00000000",
        "0x00000000",
        "0x00000000",
        "0x00000000",
        "0x00000000",
        "0x00000000",
        "0x00000000",
        "0x00000000",
        "0x00000000",
        "0x00000000",
        "0x00000000",
        "0x00000000",
        "0x00000000",
        "0x00000000",
        "0x00000000",
        "0x00000000",
        "0x00000000",
        "0x00000000",
        "0x00000000",
        "0x00000000",
        "0x00000000",
        "0x00000000",
        "0x00000000",
        "0x00000000",
        "0x00000000",
        "0x00000000",
        "0x00000000",
        "0x00000000",
        "0x00000000",
        "0x00000000",
        "0x00000000",
        "0x00000000",
        "0x00000000",
        "0x00000000",
        "0x00000000",
        "0x00000000",
        "0x00000000",
        "0x00000000",
        "0x00000000",
        "0x00000000",
        "0x00000000",
        "0x00000000",
        "0x00000000",
        "0x00000000",
        "0x00000000",
        "0x00000000",
        "0x00000000",
        "0x00000000",
        "0x00000000",
        "0x00000000",
        "0x00000000",
        "0x00000000",
        "0x00000000",
        "0x00000000",
        "0x00000000",
        "0x00000000",
        "0x00000000",
        "0x00000000",
        "0x00000000",
        "0x00000000",
        "0x00000000",
        "0x00000000",
        "0x00000000",
        "0x00000000",
        "0x00000000",
        "0x00000000",
        "0x00000000",
        "0x00000000",
        "0x00000000",
        "0x00000000",
        "0x00000000",
        "0x00000000",
        "0x00000000",
        "0x00000000",
        "0x00000000",
        "0x00000000",
        "0x00000000",
        "0x00000000",
        "0x00000000",
        "0x00000000",
        "0x00000000",
        "0x00000000",
        "0x00000000",
        "0x00000000",
        "0x00000000",
        "0x00000000",
        "0x00000000",
        "0x00000000",
        "0x00000000",
        "0x00000000",
        "0x00000000",
        "0x00000000",
        "0x00000000",
        "0x00000000",
        "0x00000000",
        "0x00000000",
        "0x00000000",
        "0x00000000",
        "0x00000000",
        "0x00000000",
        "0x00000000",
        "0x00000000",
        "0x00000000",
        "0x00000000",
        "0x00000000",
        "0x00000000",
        "0x00000000",
        "0x00000000",
        "0x00000000",
        "0x00000000",
        "0x00000000",
        "0x00000000",
        "0x00000000",
        "0x00000000",
        "0x00000000",
        "0x00000000",
        "0x00000000",
        "0x00000000",
        "0x00000000",
        "0x00000000",
        "0x00000000",
        "0x00000000",
        "0x00000000",
        "0x00000000",
        "0x00000000",
        "0x00000000",
        "0x00000000",
        "0x00000000",
        "0x00000000",
        "0x00000000",
        "0x00000000",
        "0x00000000",
        "0x00000000",
        "0x00000000",
        "0x00000000",
        "0x00000000",
        "0x00000000",
        "0x00000000",
        "0x00000000",
        "0x00000000",
        "0x00000000",
        "0x00000000",
        "0x00000000",
        "0x00000000",
        "0x00000000",
        "0x00000000",
        "0x00000000",
        "0x00000000",
        "0x00000000",
        "0x00000000",
        "0x00000000",
        "0x00000000",
        "0x00000000",
        "0x00000000",
        "0x00000000",
        "0x00000000",
        "0x00000000",
        "0x00000000",
        "0x00000000",
        "0x00000000",
        "0x00000000",
        "0x00000000",
        "0x00000000",
        "0x00000000",
        "0x00000000",
        "0x00000000",
        "0x00000000",
        "0x00000000",
        "0x00000000",
        "0x00000000",
        "0x00000000",
        "0x00000000",
        "0x00000000",
        "0x00000000",
        "0x00000000",
        "0x00000000",
        "0x00000000",
        "0x00000000",
        "0x00000000",
        "0x00000000",
        "0x00000000",
        "0x00000000",
        "0x00000000",
        "0x00000000",
        "0x00000000",
        "0x00000000",
        "0x00000000",
        "0x00000000",
        "0x00000000",
        "0x00000000",
        "0x00000000",
        "0x00000000",
        "0x00000000",
        "0x00000000",
        "0x00000000",
        "0x00000000",
        "0x00000000",
        "0x00000000",
        "0x00000000",
        "0x00000000",
        "0x00000000",
        "0x00000000",
        "0x00000000",
        "0x00000000",
        "0x00000000",
        "0x00000000",
        "0x00000000",
        "0x00000000",
        "0x00000000",
        "0x00000000",
        "0x00000000",
        "0x00000000",
        "0x00000000",
        "0x00000000",
        "0x00000000",
        "0x00000000",
        "0x00000000",
        "0x00000000",
        "0x00000000",
        "0x00000000",
        "0x00000000",
        "0x00000000",
        "0x00000000",
        "0x00000000",
        "0x00000000",
        "0x00000000",
        "0x00000000",
        "0x00000000",
        "0x00000000",
        "0x00000000",
        "0x00000000",
        "0x00000000",
        "0x00000000",
        "0x00000000",
        "0x00000000",
        "0x00000000",
        "0x00000000",
        "0x00000000",
        "0x00000000",
        "0x00000000",
        "0x00000000",
        "0x00000000",
        "0x00000000",
        "0x00000000",